{
  "type": "array",
  "minItems": 1,
  "items": {
    "type": "object",
    "additionalProperties": false,
    "required": [
      "id",
      "width",
      "depth",
      "roles"
    ],
    "properties": {
      "id": {
        "type": "string",
        "minLength": 1
      },
      "width": {
        "type": "number",
        "exclusiveMinimum": 0
      },
      "depth": {
        "type": "number",
        "exclusiveMinimum": 0
      },
      "entrance": {
        "type": "boolean"
      },
      "ruined": {
        "type": "boolean"
      },
      "roles": {
        "type": "array",
        "minItems": 1,
        "items": {
          "type": "object",
          "additionalProperties": false,
          "required": [
            "id",
            "asset"
          ],
          "properties": {
            "id": {
              "type": "string",
              "minLength": 1
            },
            "asset": {
              "type": "string",
              "minLength": 1
            },
            "parent": {
              "type": [
                "string",
                "null"
              ]
            },
            "x": {
              "type": "number"
            },
            "z": {
              "type": "number"
            },
            "height": {
              "type": "number"
            },
            "yaw": {
              "type": "number"
            },
            "required": {
              "type": "boolean"
            },
            "entrance": {
              "type": "boolean"
            },
            "growsThrough": {
              "type": [
                "string",
                "null"
              ]
            },
            "width": {
              "type": "number",
              "minimum": 0
            }
          }
        }
      },
      "closedBoundary": {
        "type": "boolean"
      },
      "boundary": {
        "type": "array",
        "items": {
          "type": "object",
          "additionalProperties": false,
          "required": [
            "x",
            "z"
          ],
          "properties": {
            "x": {
              "type": "number"
            },
            "z": {
              "type": "number"
            }
          }
        }
      },
      "approach": {
        "type": "array",
        "items": {
          "type": "object",
          "additionalProperties": false,
          "required": [
            "x",
            "z"
          ],
          "properties": {
            "x": {
              "type": "number"
            },
            "z": {
              "type": "number"
            }
          }
        }
      },
      "maxTerrainRise": {
        "type": "number",
        "exclusiveMinimum": 0,
        "maximum": 4
      }
    }
  },
  "$schema": "https://json-schema.org/draft/2020-12/schema"
}
